{
  "id": "granny-square-grid",
  "description": "Geometric precision grid with a granny square pattern, creating structured and defined visual elements.",
  "canvas": {
    "w": 1024,
    "h": 1024,
    "bg": "#2e2e2e"
  },
  "palette": [
    "#ff6b6b",
    "#ffd93d",
    "#6bcb77",
    "#4d96ff",
    "#ffffff"
  ],
  "layers": [
    {
      "type": "grain",
      "amount": 0.03,
      "size": 1.5
    },
    {
      "type": "flowField",
      "count": 600,
      "step": 1.5,
      "strokeAlpha": 45,
      "noise": {
        "scale": 0.008,
        "zSpeed": 0.001
      }
    }
  ],
  "claims": {
    "dominant_hues": [
      "red",
      "yellow",
      "green",
      "blue"
    ],
    "symmetry": "med",
    "flow": "low",
    "density": 0.3,
    "motifs": [
      "grid",
      "geometric",
      "squares"
    ]
  },
  "knobs": [
    {
      "key": "strokeAlpha",
      "effect": "Higher alpha increases visibility of geometric edges",
      "range": [
        30,
        60
      ]
    },
    {
      "key": "count",
      "effect": "More elements create a denser grid pattern",
      "range": [
        400,
        800
      ]
    },
    {
      "key": "step",
      "effect": "Larger steps create more spaced-out patterns",
      "range": [
        1,
        2.5
      ]
    },
    {
      "key": "noiseScale",
      "effect": "Higher values introduce more complexity in the grid structure",
      "range": [
        0.005,
        0.02
      ]
    }
  ]
}